Order,Title,New_Title,Definition
418,On the nose,On the nose,1. Precisely accurate; exactly right. 
419,Hit the nail on the head,Hit the nail (right) on the head,"1. Literally, to strike a nail on its head (the flat, circular end). "
420,Kick the bucket,,
421,Strike while the iron is hot,Strike while the iron is hot,To make most of an opportunity or favorable conditions while one has the chance to do so. 
422,Set in stone,Set in stone,Permanent. Typically refers to a plan or idea. 
423,The clay is dry,,
424,Trail of bread crumbs,,
425,Hanging on by a thread,Hang on by a thread,"To be perilously close to failing, dying, or resulting in a bad outcome. "
426,Green thumb,Green thumb,"A proclivity for successfully growing plant life. (Often used with ""have."") "
427,Splitting hairs,Split hairs,"To make or focus on trivial or petty details, differences, or distinctions. "
428,Beast of burden,Beast of burden,A domesticated animal used by humans to carry or pull heavy loads. 
429,Hang me out to dry,Hang (one) out to dry,To desert one in a troubling situation. 
430,With out a pot to piss in or a window to throw it out of,,
431,Without a leg to stand in,,
432,Paint yourself into a corner,Paint (oneself) into a corner,To create a predicament or unpleasant situation for oneself whereby there are no or very few favorable solutions or outcomes. 
433,Shooting from the hip,Shoot from the hip,"To speak or act rashly, recklessly, or bluntly, without consideration of potential consequences. An allusion to firing a handgun immediately upon drawing it from its holster without taking time to aim. "
434,Outside of my wheelhouse,Out(side) (of) (someone's) wheelhouse,"Against, outside of, or not matching someone's general interests, abilities, or area of familiarity; outside of someone's comfort zone. "
435,Above my pay grade,Above (one's) pay grade,"1. The responsibility of those who are of a higher authority than oneself, denoted by the level of pay that one receives in comparison to one's superiors. "
436,Caught in the crosshairs,,
437,Target on you back,,
438,Price on your head,,
439,Death by 1000 cuts,,
440,Can’t trust them as far as you can throw them,,
441,Throw caution to the wind,Throw caution to the wind(s),To abandon one's cautiousness in order to take a risk. 
442,Hold your horses,Hold your horses,Wait a moment or be patient (often because you are moving too quickly or thoughtlessly). 
443,Bring a knife to a gunfight,Bring a knife to a gunfight,"To come poorly prepared or equipped for some task, goal, competition, or confrontation. Often used in the negative as a forewarning or piece of advice. "
444,Mexican standoff,Mexican standoff," An impasse, deadlock, or stalemate from which no party involved will or can emerge victorious. Also written ""stand-off."" (Note: This phrase may be considered offensive to Mexicans or those of Mexican heritage.) Primarily heard in US. "
445,Play your cards right,Play (one's) cards right,To act adeptly and with good judgment; to make the best and most effective use of the resources at one's disposal. 
446,Play your cards close to the chest,,
447,Ace up your sleeve,Ace up (one's) sleeve,"A secret plan, idea, or advantage that can be utilized if and when it is required. A reference to cheating at a card game by hiding a favorable card up one's sleeve. "
448,Coming in hot,,
449,Hold your hand,Hold (one's) hand,"1. Literally, to grasp one's hand and continue holding it, typically while walking together or sitting next to each other, often as a show of affection. "
450,The 11th hour,The eleventh hour,The last possible moment or opportunity. Can be hyphenated if used as a modifier before a noun. 
451,A real class act,,
452,For the birds,For the birds," Worthless, stupid, or completely undesirable. "
453,Make ends meet,Make (both) ends meet,To earn just enough money to cover one's living expenses. 
454,Wear your heart on your sleeve,Wear (one's) heart on (one's) sleeve,To openly display or make known one's emotions or sentiments. 
455,Got it in the bag,,
456,Idle hands are the devils playground,,
457,Secure the bag,,
458,Slow your roll,Slow (one's) roll, To calm oneself down. Primarily heard in US. 
459,Off the beaten path,Off the beaten path,"1. Little-known, or in a remote or lesser-known area. Said especially of a business or destination. A ""beaten path"" refers to a route that is frequently traveled. "
460,Read em and weep,Read 'em and weep,"Look at these results, which clearly show that I am the winner and you are the loser. A clichéd expression that is especially commonly used during card games. "
461,My hands are tied,(one's) hands are tied,"One is being prevented from acting, helping, or intervening as one should or desires to because of circumstances beyond one's control, such as rules, conflicting orders, or higher priorities. "
462,With one had tied behind my back,,
463,Knock your dick in the dirt,,
464,Moving the goalpost,Move the goalposts,"To alter the rules or parameters of a situation in such a way as to suit one's needs or objectives, making it more difficult for someone else to succeed, keep pace, or achieve an opposing objective. "
465,Pulling the rug from under you,Pull the rug (out) from under (someone),"To suddenly or unexpectedly remove or rescind support, help, or assistance from someone; to abruptly leave someone in a problematic or difficult situation. "
466,All roads lead to rome,All roads lead to rome,"The same outcome can be reached by many methods or ideas. This phrase refers to the road system of the Roman Empire, in which Rome was positioned in the center, with every road attached to it. "
467,Walk in the park,A walk in the park,A task or activity that is easy or effortless to accomplish. 
468,Too many irons in the fire,Too many irons in the fire,An excessive number of simultaneous activities or potential undertakings or opportunities underway. 
469,Two tacos short of a combination plate,,
470,A whole other ball game,,
471,Burying your head in the sand,Bury (one's) head in the sand,"To avoid, or try to avoid, a particular situation by pretending that it does not exist. The phrase refers to the common but mistaken belief that ostriches bury their heads in the sand when frightened, so as to avoid being seen. "
472,Burn a hole in your pocket,Burn a hole in (one's) pocket,"To be in one's possession and causing one an intense urge to make use of it. Typically used in reference to money, suggesting that the person with the money feels the need to spend it quickly. "
473,Letting your true colors shine,,
474,If you fall of your horse you gotta get back on,,
475,If you want to make god laugh make a plan,,
476,Gun shy,Gun-shy,1. Frightened of using a gun or by the sound of one firing. 
477,Trigger happy,Trigger-happy,"1. Eager to use a weapon, i.e. to pull the trigger (of a gun). "
478,You can’t take it with you,(you) can't take it with you (when you go), A warning against materialism that alludes to the fact that you can't keep your money or possessions when you die. 
479,Doesn’t pack a punch,,
480,A drop in the bucket,Drop in the bucket,"A tiny amount, especially when compared to a much larger one. "
481,Opiate of the masses,The opiate of the masses,"That which creates a feeling of false happiness, contentment, or numbness to reality. Adapted from Karl Marx's description of organized religion. "
482,The faster they rise the harder they fall,,
483,Out of sight out of mind,"Out of sight, out of mind",That which cannot be seen or is not noticeable will be forgotten. 
484,Wearing multiple hats,,
485,Jack of all trades,Jack of all trades,A person who is skilled in many different areas. 
486,The nearer the bone the sweeter the meat,"The nearer the bone, the sweeter the meat", The last parts of something are the most enjoyable. 
487,To worry is to make payments on a debt that may never come due,,
488,A rolling stone gathers no moss,A rolling stone gathers no moss," A person who wanders or travels often and at length will not be burdened by attachments such as friends, family, or possessions. Can be used as a negative (to suggest that such a person won't find a fulfilling place in life) or as a positive (to suggest that they will have a more interesting and unpredictable life). "
489,Necessity is the mother of invention,Necessity is the mother of invention, Creative solutions are often produced in response to difficulties or hardships that need to be overcome. 
490,A day late and a dollar short,A day late and a dollar short,Too late to be of any benefit. 
491,Sixpence none the richer,History,
492,Lose the battle but win the war,"Lose the battle, but win the war","To suffer a minor defeat or failure, but achieve a larger, more important, or overarching success or victory over time. The phrase is often split into two halves across different parts of a sentence to achieve its meaning. "
493,Uncharted waters,Uncharted waters,"A situation or circumstance that is foreign, unclear, or unfamiliar and which may be dangerous or difficult as a result. "
494,For whom the bell tolls,Background,Ernest Hemingway wrote 
495,Never look into another bowl except to see if they have enough,,
496,A rose by any other name would smell as sweet,A rose by any other name (would smell as sweet),What someone or something is called does not change their innate characteristics or attributes. The shorter version of the phrase is often used when describing undesirable people or things. The full line is from Shakespeare's 
497,He who laughs last laughs best,Have the last laugh,To ultimately achieve success after encountering adversity or doubt from others. 
498,Kiss the ring,Kiss the ring,"To make a gesture of deference, fealty, or genuflection to a person of power or authority. "
499,A prison of our own device,,
500,What goes around comes around,What goes around comes around," One's actions or behavior will eventually have consequences for one, even if indirectly. The phrase typically refers to one being a victim of the same negative circumstances that they have inflicted on others. "
501,If your going to get we you might as well go swimming,,
502,Don’t cry over spilt milk,,
503,Put someone on a pedestal,Put (someone or something) (up) on a pedestal,"To believe or behave as if someone or something is perfect, wonderful, or better than others, to the extent that one is unable to see its potential flaws or faults. "
504,The view from your ivory tower,,
505,On your high horse,On (one's) high horse,Having an attitude of condescending moral superiority. 
506,Turn a blind eye,Turn a blind eye (to something),To knowingly ignore some wrongdoing. 
507,Cat got your tongue,(has the) cat got your tongue?,A humorous question directed at one who is not speaking very much or at all. 
508,Hard nut to crack,A hard nut (to crack),"A person, thing, situation, or problem that is particularly difficult to understand, solve, or deal with. "
509,Up shit creek without a paddle,Up shit creek (without a paddle)," In a challenging or troublesome situation, especially one that cannot be easily resolved. "
510,Even the Mona Lisa is falling apart,,
511,Diamonds are made under pressure but not over night,,
512,"Men are from mars, women are from Venus",,
513,Reopen an old wound,,
514,Pour salt in the wound and expect it to heal,,
515,Swimming with the fishes,Be swimming with the fishes," To be murdered and have one's body disposed of in a river, lake, or ocean. (A less common variant of ""be sleeping with the fishes."") "
516,Light at the end of the tunnel,Light at the end of the tunnel,A sign that something difficult or unpleasant is almost at an end. 
517,Pride is a cold bedfellow,,
518,Cut off the head and the body will die,,
519,The little dutch boy with his finger in the dike,,
520,A hard pill to swallow,A hard pill to swallow,"Something, especially a fact or piece of news, that is unpleasant or difficult but which is unavoidable or must be accepted. "
521,Nothing left to do but bite the bullet,,
522,Bring home the bacon,Bring home the bacon,"1. To earn money, as from steady employment. The phrase may originate from the fairground contest in which participants try to catch a greased pig in order to win it. "
523,Butter your bread on both sides,Butter (one's) bread on both sides,1. To benefit or profit from two or more separate and often contradictory or incompatible things or sources. 
524,Slap my ass and call me Sally,,
525,The bigger the pants the deeper the pockets,,
526,Ask me your questions I’ll tell you my lies,,
527,In the belly of the beast,In the belly of the beast," Within the worst, most central area or part of something deeply unpleasant or malicious. "
528,Wild goose chase,Wild goose chase,A prolonged or chaotic search for something that is difficult to find (often because it does not exist). 
529,Jack of all trades,Jack of all trades,A person who is skilled in many different areas. 
530,Cut the mustard,Cut the mustard,1. 
531,Don’t pull the wool over my eyes,,
532,Shoot yourself in the foot,Shoot (oneself) in the foot,"To damage or impede one's own plans, progress, or actions through foolish actions or words. "
533,Salad days,Salad days,"A youthful, carefree time of innocence and inexperience. The phrase comes from a line in Shakespeare's "
534,Bone to pick,A bone to pick,An issue to discuss—typically one that is a source of annoyance for the speaker. 
535,Bigger fish to fry,Bigger fish to fry,More important matters to deal with. 
536,Herding cats,Be like herding cats,To be very unwieldy or unmanageable; to be nearly impossible to organize. Usually said of a group of people. 
537,Taste of your own medicine,A taste of (one's) own medicine,An experience of the same harmful or unpleasant thing that one has inflicted on others; an attack in the same manner in which one attacks others. 
538,March to the best of your own drum,,
539,Cross your heart and hope to die,,
540,Scraping the bottom of the barrel,Scrape the bottom of the barrel,"To use or select from the last or worst of the resources or options from a particular range or set, even if they are not satisfactory, because there are no others to choose from. "
541,Gift that keeps on giving,The gift that keeps on giving,"Something that continues to have a payoff, consequences, or other such impact. "
542,Let me sleep on it,,
543,Don’t sleep on it,,
544,Down the rabbit hole,Down a/the rabbit hole,"1. In a situation, process, or journey that is particularly strange, problematic, difficult, complex, or chaotic, especially one that becomes increasingly so as it develops or unfolds. (An allusion to "
545,Level the playing field,Level the playing field,"To make a situation or activity more fair and balanced by giving an extra advantage or opportunity to those who would normally be at a disadvantage, or by attempting to take away or diminish advantages, perhaps of one's adversary or competitor. "
546,Your ass is grass,(one's) ass is grass,
547,Don’t shoot the messenger,Don't shoot the messenger,Don't get angry at or punish someone who is simply delivering bad or undesirable news as they are not responsible for it. 
548,Don’t hate the player hate the game,"Don't hate the player, hate the game", You should hate a system or situation rather than the people involved in it. 
549,Bucket list,Bucket list,"A list of accomplishments or tasks one hopes to do or achieve before one dies. ""Bucket"" here is taken from the phrase ""kick the bucket,"" meaning to die. "
550,Partner in crime,Partner in crime,1. One who aids or accompanies someone in crimes or nefarious actions. 
551,Anyway you slice it,,
552,All is fair in love and war,All is fair in love and war,"Otherwise questionable actions are acceptable under extenuating circumstances. Often written as ""all's fair in love and war."" "
553,Above my pay grade,Above (one's) pay grade,"1. The responsibility of those who are of a higher authority than oneself, denoted by the level of pay that one receives in comparison to one's superiors. "
554,Not on my dime,,
555,Light in the loafers,Light in the loafers,"pejorative Homosexual, especially of men. "
556,Rubbing elbows,Rub elbows,To interact or mingle with a person or group. 
557,Beating around the bush,Beat around the bush,To speak vaguely or euphemistically so as to avoid talking directly about an unpleasant or sensitive topic. Primarily heard in US. 
558,Keep your friends close and your enemies closer,Keep your friends close and your enemies closer,Be very aware of your enemies' behavior in order to detect and avoid any malicious actions. 
559,Keep your eyes on the prize,Keep your eye(s) on the prize,"To remain focused on a particular goal or award, especially when the path to it is long or arduous. "
560,Under the radar,Under (the/one's) radar,"Without being noticed, detected, or addressed. "
561,Take under your wing,,
562,Straw that broke the camel’s back,The straw that breaks the camel's back,"A seemingly small or inconsequential issue, problem, or burden that proves to be the final catalyst in causing an overworked or overburdened person, system, organization, etc., to fail, give up, or collapse. "
563,Late in the game,Late in the game,"At a late point in some situation, development, activity, etc. Likened to an athletic game or match. "
564,Last straw,The last straw,"The final problem, setback, or source of irritation in a series that causes one to finally lose patience or for something to stop working. A shortening of the proverb ""it is the last straw that breaks the camel's back."" "
565,Connect the dots,Connect the dots,"1. Literally, to draw a line between dots, often as part of a children's activity to create an illustration or design. "
566,Dancing with the devil,,
567,When push comes to shove,If push comes to shove,If the situation deteriorates or becomes desperate; if drastic measures are needed. 
568,Been around the block,Been around (the block),"To have experience, either in a particular area or in one's life overall. "
569,Eye for an eye,Eye for an eye (and a tooth for a tooth).," If someone hurts you, you should punish the offender by hurting him or her in the same way. (An ancient principle of justice going back to biblical times.) "
570,Eyes in the back of your head,Eyes in the back of (one's) head,"The ability to detect what is going on all around one, even beyond one's field of vision. "
571,In the clear,In the clear,Deemed innocent or able to avoid blame for some crime or misdeed. 
572,Cold turkey,Cold turkey,The abrupt cessation of something (most often the use of a drug). 
573,We’re gonna need a bigger boat,,
574,It’s all greek to me,(it's) (all) greek to me," This might as well be a foreign language, because I don't understand it at all. The phrase comes from Shakespeare's play "
575,How do you like them apples,How do you like them apples,"1. A phrase used to draw attention to one's cleverness or superiority to the one being addressed, especially after a recent triumph. "
576,Break the mold,Break the mold,To do something in a new way. 
577,Worth your weight in salt,,
578,Turn on a dime,Turn on a dime,1. To turn very quickly and with great agility. 
579,Hold down the fort,Hold (down) the fort,"To maintain the proper functioning or order of some situation or place, typically during someone's absence. "
580,I’m all ears,I'm all ears,I'm ready and eager to hear what you have to say. 
581,Bend over backwards,Bend over backward(s), To exert a lot of effort towards some end. This phrase is often used to express frustration when one's efforts go unrecognized. 
582,Wrapped around their little finger,,
583,No spring chicken,No spring chicken," No longer young or youthful. (A ""spring chicken"" refers to a young chicken.) "
584,Counting sheep,Count sheep,1. To perform any repetitive or monotonous thought exercise as a means of calming the mind to try to fall asleep (such as the traditional sleep aid of counting imaginary sheep). 
585,Leg up in life,,
586,Put your pants on one leg at a time,Put (one's) pants on one leg at a time (just like everybody else),"To be an ordinary human being; to go through life like everyone else. (Used especially in reference to someone who is of an elevated social status, such as a celebrity, star athlete, member of royalty, etc. Variations of ""everybody else"" are also often used, such as ""the rest of us,"" ""you and me,"" ""ordinary people,"" and so on.) Primarily heard in Australia. "
587,Boots on the ground,Boots on the ground,Soldiers who are on active duty and physically present during a combat operation. 
588,Down to the nitty gritty,,
589,Knock on wood,Knock on wood,"A superstitious expression said, typically in combination with actually touching or knocking on a wooden object or surface, when one desires something positive to continue, lest the mention of it ""jinx"" or somehow reverse one's good fortune. "
590,Salt of the earth,The salt of the earth,"A person or group that is regarded as genuine, unpretentious, and morally sound. This phrase is typically complimentary. "
591,Under the weather,Under the weather,1. Mildly ill. 
592,Fly in in the ointment,,
593,Nothing to write home about,Nothing to write home about,"Not especially impressive, remarkable, or noteworthy; rather dull, mediocre, uninteresting, or unimportant. "
594,A hired gun,,
595,Dropped the ball,Drop the ball,1. To make a mistake. 
596,Bury the hatchet,Bury the hatchet,1. To make peace with someone. 
597,Open the floodgates,Open the floodgates,To allow for an expanding number of (typically negative) consequences as the result of another related action. 
598,See a man about a horse,See a man about a horse,"To leave somewhere without explaining where one is going, but usually used as an obvious euphemism for going to the toilet or getting an alcoholic drink. "
599,Taken with a grain of salt,Take (something) with a grain of salt,"To consider or evaluate something, such as a statement, with the understanding that it may not be completely true or accurate, typically due to the unreliability of the source. "
600,Trust you as far as i can throw you,,
601,You made your bed now you got to lay in it,,
602,Rolling with the punches,Roll with the punches,"1. Literally, in martial arts (especially boxing), to maneuver one's body away from a blow so as to lessen the force of the impact. "
603,Two way street,Two-way street,A situation in which both sides must put forth an equal amount of effort to achieve a desired result. 
604,Double down,Double down,"1. In blackjack, to double one's wager after seeing one's initial hand of cards, with only one more card allowed to be drawn afterward. "
605,Stand your ground,Stand (one's) ground,1. To brace oneself and maintain one's position during or when anticipating an attack. 
606,Dust your shoulders off,,
607,Blowing steam,,
608,Thrown to the wolves,Wolf,
609,Throw under the bus,Throw (one) under the bus,"1. To exploit one's trust for an ulterior purpose, advantage, or agenda; to harm one through deceit or treachery. "
610,Raised by wolves,Raised by wolves,Of or describing someone who seems particularly uncouth or socially inept. 
611,Leaving a trail of breadcrumbs,,
612,Get with the program,Get with the program,To conform or fall in line with what is expected. 
613,Water under the bridge,Water under the bridge,A prior issue that is now resolved or considered resolved. 
614,Shit or get off the pot,Shit or get off the pot, Either commit to doing something productive or step aside and stop wasting time. 
615,On the shoulders with of giants,,
616,Pull out all the stops,Pull out all the stops,To do something with maximum effort or ability; to use all or the best available resources when doing something. 
617,Steal their thunder,Steal (one's) thunder,"1. To garner the attention or praise that one had been expecting or receiving for some accomplishment, announcement, etc. "
618,Wash your hands of the whole affair,,
619,Break the bank,Break the bank,To be very expensive. The phrase is often used in the negative to convey the opposite. 
620,Speak of the devil and he shall appear,"Speak of the devil, and he shall appear", An acknowledgment of a person who has arrived just as or after they were being discussed. 
621,Curiosity killed the cat but satisfaction brought it back,,
622,Wake up and smell the coffee,Wake up and smell the coffee,Pay attention to what is happening. 
623,You can’t put the toothpaste back in the tube,Put the toothpaste back in the tube,"To attempt to revert a situation to how it formerly existed by containing, limiting, or repressing information, ideas, advancements, etc., that have become commonplace or public knowledge. Almost always used in the negative to denote the impossibility of such an attempt. "
624,A pictures worth a 1000 words,,
625,Doing the lord’s work,,
626,When small men cast long shadows the day is almost over,,
627,Meat and potatoes,Meat-and-potatoes,Concerned with or pertaining to the most basic or fundamental aspects of something. 
628,Beating your head against the wall,Beat (one's) head against a/the wall,To attempt continuously and fruitlessly to accomplish some task or achieve some goal that is or seems ultimately hopeless. 
629,Barking up the wrong tree,Bark up the wrong tree,"To attempt or pursue a futile course of action, often by making some kind of suggestion or request. "
630,Falling on deaf ears,Fall on deaf ears,To be ignored. 
631,Don’t ask how the sausage is made,,
