Order,Title,New_Title,Definition
1,"Not my circus, not my monkeys","Not my circus, not my monkeys","This troublesome, burdensome, or volatile situation is none of my concern, and thus I refuse to get involved in it. A loan translation of the Polish idiom "
2,Waiting with baited breath,Wait with bated breath,To remain in a state of eager anticipation (of or for something). 
3,Don’t hold your breath,Don't hold your breath,Don't expect something to happen. (The idea being that one couldn't hold one's breath long enough for the unlikely thing to happen.) 
4,People in glass houses shouldn’t throw stones,People (who live) in glass houses shouldn't throw stones.," People who are vulnerable to criticism should not criticize others, especially not for the faults that they themselves have (since such criticism will likely be returned). "
5,Don’t look a gift horse in the mouth,Don't look a gift horse in the mouth,"If you receive a gift, do so graciously, without voicing criticisms. The saying is attributed to St. Jerome and refers to the practice of looking at a horse's teeth to determine its age. "
6,Don’t count your chickens before they hatch,Don't count your chickens before they hatch.," Don't make plans based on future events, outcomes, or successes that might not come to pass. "
7,Don’t keep all your eggs in one basket,,
8,A bird in the hand is worth two in the bush,A bird in the hand is worth two in the bush, It is better to have something less valuable than to pursue something more valuable that may not be able to be obtained. 
9,There’s more than one way to skin a cat,There's more than one way to skin a cat, There are many methods one may employ in achieving one's ends. 
10,Let the cat out of the bag,Let the cat out of the bag,To reveal a secret. 
11,Open a can of worms,Open (up) a can of worms,"To initiate, instigate, or reveal a situation that is or is likely to become very complicated or problematic or that will have a negative outcome. "
12,Bull in a china shop,A bull in a china shop,Someone who is aggressively reckless and clumsy in a situation that requires delicacy and care. 
13,One trick pony,A one-trick pony,"A person, group, or thing that is known for or limited to only one unique or noteworthy skill, talent, ability, quality, area of success, etc. "
14,Don’t piss on my leg and tell me it’s raining,,
15,Too many chefs in the kitchen,Too many chefs in the kitchen,"Too many people are trying to control, influence, or work on something, with the quality of the final product suffering as a result. (A variation of the more common phrase, ""Too many chefs spoil the broth/stew/soup."") "
16,If you can’t handle the heat get out of the kitchen,,
17,Running on fumes,Running on fumes,"Continuing to operate with no or very little enthusiasm, energy, or resources left. A reference to a car that has nearly run out of fuel. "
18,One bad apple spoils the bunch,One bad apple spoils the (whole) bunch," It only takes one person, thing, element, etc., to ruin the entire group, situation, project, etc. Refers to the fact that a rotting apple can cause other apples in close proximity to begin to rot as well. "
19,The cream rises to the top,The cream (always) rises to the top,"Those with the most skill, the best work ethic, or the strongest moral character will inevitably find success in life. "
20,Cut from a different cloth,,
21,Don’t be a stick in the mud,,
22,Don’t rain on my parade,Don't rain on (one's) parade,Don't ruin one's plans or temper one's excitement. 
23,Even the darkest storm cloud has a silver lining,,
24,Mess with a bull you get the horn,,
25,It’s always darkest before dawn,,
26,When it rains it pours,"When it rains, it pours"," When something good or bad happens, similarly good or bad things tend to follow. "
27,Time waits for no man,,
28,Even a broken clock is right twice a day,,
29,For whom the bell tolls,Background,Ernest Hemingway wrote 
30,Make hay while the sun is shining,Make hay while the sun is shining,To take advantage of favorable conditions; to make the most of an opportunity when it is available. 
31,Mellow is the man who knows what he’s missing,,
32,Can’t teach an old dog new tricks,It's hard to teach an old dog new tricks,"It is exceptionally difficult to teach some new skill or behavior to someone, especially an older person, who is already firmly set in their ways. "
33,Hindsight’s 20/20,Hindsight is (always) 20/20,It is easier to clearly reevaluate past actions or decisions than when they are being made or done; things are clearer or more obvious when they are reflected upon. A reference to the visual acuity of normal eyesight (20/20 vision). 
34,Give a mouse a cookie and he’ll ask for a glass of milk,,
35,Give an inch and they take a mile,,
36,The more the merrier,The more the merrier,More people will make something more enjoyable. Often used to welcome one to join a group or activity. 
37,Measure twice cut once,"Measure twice, cut once",An axiom that encourages careful first steps in order to avoid extra work later on. 
38,"Give a man a fish, feed him for a day; teach a man to fish, feed him for a lifetime",,
39,You can bring a horse to water but can’t make it drink,,
40,One man’s trash is another man’s treasure,One man's trash is another man's treasure, What one person may consider worthless could be highly prized or valued by someone else. 
41,Burning the candle at both ends,Burn (one's)/the candle at both ends,"To overwork or exhaust oneself by doing too many things, especially both late at night and early in the morning. "
42,Polishing a turd,Polish a turd," To make something unpleasant seem more appealing than it really is—which is often a futile effort. ""Turd"" is a slang term for a piece of feces. "
43,"Put lipstick on a pig, its still a pig",,
44,One step forward two steps back,,
45,It’s not over till the fat lady sings,It ain't over till/until the fat lady sings,"The final outcome cannot be assumed or determined until a given situation, event, etc., is completely finished. (""Ain't"" is a colloquial contraction of ""is not."") The phrase refers to the stereotypically stout female sopranos of the opera, particularly the Valkyrie Brünnhilde, whose aria concludes Richard Wagner's opera cycle "
46,Heavy is the head that wears the crown,,
47,Pick your poison,Pick your poison,1. Tell me what alcoholic beverage you would like to drink. 
48,An axe to grind,An ax(e) to grind,1. A complaint or dispute that one feels compelled to discuss. 
49,Big shoes to fill,Big shoes to fill,A role vacated or left behind by someone who was exceptional in their performance and set very high standards as a result. 
50,The apple doesn’t fall far from the tree,The apple does not fall far from the tree,Said when someone is displaying traits or behaving in the same way as their relatives (especially parents). 
51,Chip off the old block,A chip off the old block,Someone whose character or personality resembles that of their parent. 
52,Chip on your shoulder,A chip on (one's) shoulder,An attitude that leads one to become combative or easily angered. 
53,Reinvent the wheel,Reinvent the wheel,"To do something in a wholly and drastically new way, often unnecessarily. (Usually used in negative constructions.) "
54,Two peas in a pod,Two peas in a pod,"Two people who are very similar, typically in interests, dispositions, or beliefs. "
55,Monkey on your back,Monkey on (one's) back,1. 
56,Big fish in a small pond,A big fish in a small pond,"A situation in which one person has more power, influence, knowledge, or experience than others within a small group. It often implies that the person may not have as much clout in ""a bigger pond,"" i.e., a larger group or arena of some kind. "
57,When pigs fly,When pigs fly,At a point in time that will never come to pass. (Used to show skepticism or cynicism over some hypothetical situation or outcome.) 
58,When hell freezes over,When hell freezes over,Never; at no time. 
59,Out of the frying pan and into the fire,,
60,The pot calling the kettle black,The pot calling the kettle black,A situation in which a person accuses someone of or criticizes someone for something that they themselves are guilty of. 
61,Frog in boiling water,,
62,You gotta kiss a lot of frogs to find a prince,,
63,Bat out of hell,,
64,Going to hell in a hand basket,Go to hell in a handbasket,To be in an extremely and increasingly bad or ruinous condition; to be on the inevitable path to utter failure or ruin. 
65,Bite off more then you can chew,,
66,The bigger they are the harder they fall,"The bigger they are, the harder they fall"," Those who are exceptionally large, powerful, or influential will have more to lose when they fail, and their failure will be all the more dramatic or spectacular because of it. "
67,The hair of the dog that bit you,The hair of the dog (that bit you),An alcoholic drink consumed to remedy a hangover. The phrase comes from the notion that literally rubbing the hair of the dog that bit you on the wound would help it to heal. 
68,Wish in one hand and shit in the other,,
69,All who wander are not lost,,
70,All that glitters is not gold,All that glitters is not gold,Things that have an outward appeal are often not as beautiful or valuable as they seem. 
71,Diamond in the rough,Diamond in the rough,A person or thing with exceptional qualities or characteristics that cannot be seen from the surface. 
72,Leave no stone unturned,Leave no stone unturned,1. To look for something in every possible place. 
73,All holds barred,,
74,Throw the baby out with the bath water,Throw the baby out with the bath,"To discard something valuable or important while disposing of something considered worthless, especially an outdated idea or form of behavior. The phrase is often used in the negative as a warning against such thoughtless behavior. "
75,Everything but the kitchen sink,Everything but the kitchen sink,"Nearly everything one can reasonably imagine; many different things, often to the point of excess or redundancy. "
76,Slow and steady wins the race,Slow and steady wins the race," Persistent, consistent, and diligent progress, even if it is somewhat slow, will produce better results than rushing to get somewhere or achieve something, as the latter can result in mistakes or may prove unsustainable or unreliable. Derived from the classic Aesop fable of ""The Tortoise and the Hare,"" in which the titular tortoise is able to beat the hare in a race because the hare, overconfident in his superior speed, decides to take a nap along the way. "
77,Two sides to to the same coin,,
78,Play the hand you’re dealt,Play the hand (one) is dealt,"To accept, deal with, and make the most of one's current situation or circumstances; to make use of that which one is afforded or has available. "
79,When life gives you lemons make lemonade,"When life gives you lemons, make lemonade", Focus on the good in a bad situation and take action accordingly. 
80,Put a pin in it,Put a pin in it,"To take a break from discussing some topic, with plans to resume the discussion later. "
81,The cherry on top,Cherry on top,"The flourish that caps something off (much like a cherry tops off an ice cream sundae). Sometimes used in the phrase ""pretty please with a cherry on top."" "
82,Icing on the cake,The icing on the cake,An additional benefit or positive aspect to something that is already considered positive or beneficial. 
83,The squeaky wheel gets the grease,The squeaky wheel gets the grease, The person complaining or protesting the loudest or most frequently is the one who will receive the most attention from others. 
84,Raised nails get pounded,,
85,Softer than a baby’s bottom,,
86,Hell or high water,By hell or high water,"By any means necessary; regardless of any difficulty, problem, or obstacle. "
87,Stuck between a rock and a hard place,,
88,Airing out your dirty laundry.,,
89,Skeletons in your closet,Skeleton in the/(one's) closet,An embarrassing or shameful secret. Primarily heard in US. 
90,Skating on thin ice,Skating on thin ice,"Engaged in some activity or behavior that is very risky, dangerous, or likely to cause a lot of trouble. "
91,Flying too close to the sun,Fly too close to the sun,"To do something especially ambitious and daring that can or ultimately does lead to one's own undoing or downfall. An allusion to the mythical figure Icarus, whose wings made of feathers and wax melted when he flew too close to the sun. "
92,Toot your own horn,Toot (one's) own horn,"To boast or brag about one's own abilities, skills, success, achievements, etc. "
93,Pat yourself on the back,,
94,Catch more flies with honey than vinegar,You (can) catch more flies with honey than (with) vinegar," You are more likely to get the results you want from other people if you treat them with kindness or flattery, rather than being aggressive, demanding, or caustic. "
95,Kill them with kindness,Kill (one) with kindness,"To harm, inconvenience, or bother one by treating them with excessive favor or kindness. The phrase originated as the expression ""kill with kindness as fond apes do their young,"" referring to the notion that such animals sometimes crushed their offspring by hugging them too hard. "
96,Eye for an eye makes the whole world blind,An eye for an eye makes the whole world blind," No good will result from avenging injuries in a manner equal to the original offense. The expression, widely attributed to Mahatma Gandhi, refers to the Biblical saying ""an eye for an eye, a tooth for a tooth,"" which encourages vengeance that is equal to the original injury or offense. "
97,In the land of the blind the one eyed man is king,"In the land of the blind, the one-eyed man is king", Someone with few skills or abilities can impress and wield power over those who have even less to offer. 
98,That ship has sailed,That ship has sailed,Some possibility or option is no longer available or likely. 
99,Two ships passing the night,,
100,The pen is mightier than the sword,The pen is mightier than the sword," Strong, eloquent, or well-crafted speech or writing is more influential on a greater number of people than force or violence. "
101,Double edged sword,Double-edged sword,Something that can be both beneficial and problematic. 
102,I don’t have a dog in that fight,,
103,"Spare the rod, spoil the child",,
104,Like water off a ducks back,,
105,The juice isn’t worth the squeeze,,
106,Can’t get blood from a stone,You can't get blood from a stone," It is impossible to obtain something from someone if they are too parsimonious, uncharitable, or resolved against it. "
107,Don’t judge a book by its cover,Don't judge a book by its cover,Don't base your opinion of something (or someone) on the way it (or one) looks. 
108,You can’t step into the same river twice,,
109,Don’t whistle up the wind,,
110,Stick a fork in me,Stick a fork in (me/it/something),"A phrase used to indicate that one or something is finished, complete, or no longer able to continue. Alludes to the practice of testing how thoroughly a piece of meat is cooked by piercing it with a fork. "
111,This goose is cooked,,
112,You shake it more than twice you’re playing with it,,
113,Why buy the cow when the milk is free,,
114,Don’t rock the boat,Don't rock the boat,Don't say or do something that could upset a stable situation. 
115,"If the shoe fits, wear it","If the shoe fits(, wear it)","If something (typically negative) applies to one, one should acknowledge it or accept responsibility or blame for it. "
116,"If it walks like a duck, talks like duck, it’s probably a duck",,
117,Waiting for the other shoe to drop,Wait for the other shoe to drop,"To wait for the next, seemingly unavoidable (and typically negative) thing to happen. "
118,The grass is always greener on the other side of the fence,The grass is always greener (on the other side), Other people's circumstances or belongings always seem more desirable than one's own. 
119,Birds of a feather flock together,Birds of a feather flock together," People who have similar interests, ideas, or characteristics tend to seek out or associate with one another. "
120,A goose is as good as it’s gander,,
121,Early bird gets the worm,The early bird catches the worm, 
122,Let sleeping dogs lie,Let sleeping dogs lie,To leave a situation alone so as to avoid worsening it. 
123,A stitch in time saves nine,A stitch in time (saves nine)," A prompt, decisive action taken now will prevent problems later. "
124,Every dog has his day,Every dog has his/her/their day,Even the least fortunate person will have success at some point. 
125,Reap what you sow,Reap what (one) sows,To suffer the negative consequences of one's actions. 
126,‘Till the cows come home,,
127,Chickens come home to roost,(one's) chickens come home to roost,One's previous actions will eventually have consequences or cause problems for oneself. 
128,Missed the forest for the trees,,
129,"When in Rome, do as the Romans do",When in rome (do as the romans do)," One should do what is customary or typical in a particular place or setting, especially when one is a tourist. "
130,6 in one hand half dozen in the other,,
131,6 ways to Sunday,Six ways to sunday,Thoroughly or completely; in every possible way; from every conceivable angle. 
132,Burning bridges,Burn (one's) bridges,"1. Literally, to destroy a bridge or path behind oneself, so that others cannot follow. This usage is often related to military action. "
133,Baked in the cake,Baked in the cake,Informal; a situation in which the 
134,A wolf in sheep’s clothing,A wolf in sheep's clothing,A person or thing that appears harmless but is actually dangerous or bad. 
135,Does a bear shit in the woods,Does a bear shit in the woods?," A rhetorical question meaning the answer to the previous question is emphatically and obviously ""yes."" "
136,Raining cats and dogs,It's raining cats and dogs,It is raining extremely heavily. 
137,Oldest trick in the book,The oldest trick in the book,"A method of deception, or of addressing some issue, that is well known or has been used for a long time. "
138,I’m picking up what you’re putting down,,
139,Biting the hand that feeds you,Bite the hand that feeds (you),To scorn or poorly treat those on whom you depend or derive benefit. 
140,Put you’re money where your mouth is?,,
141,Get your ducks in a row,Get (one's) ducks in a row,"To take action to become well-organized, prepared, or up-to-date. "
142,As the crow flies,As the crow flies,The measurement of distance in a straight line. (From the notion that crows always fly in a straight line.) 
143,The lights are on by nobody is home,,
144,Not playing with a full deck,Not playing with a full deck,1. Not mentally sound; crazy or mentally deranged. 
145,Pay the pied piper,,
146,Got a screw loose,,
147,Walk a mile in someone’s shoes,Walk a mile in (someone's) shoes,"To spend time trying to consider or understand another person's perspectives, experiences, or motivations before making a judgment about them. "
148,This isn’t my first rodeo,Not (one's) first rodeo,"One is experienced with a certain situation, especially in relation to potential pitfalls or deceitful practices by others. "
149,Bury the hatchet,Bury the hatchet,1. To make peace with someone. 
150,Proof is in the pudding,The proof is in the pudding,The final results of something are the only way to judge its quality or veracity. 
151,Look what the cat dragged in,Look what the cat('s) dragged in,A mild and usually playful insult used to announce someone's arrival and suggest that the person has a messy or otherwise disheveled physical appearance. 
152,Spill the beans,Spill the beans,To reveal something that was meant to be a secret. 
153,At loose ends,At loose ends,"Uneasy, typically due to some problem or unresolved issue. "
154,Canary in a coal mine,Canary in a/the coal mine,"Something or someone who, due to sensitivity to his, her, or its surroundings, acts as an indicator and early warning of possible adverse conditions or danger. Refers to the former practice of taking caged canaries into coal mines. The birds would die if methane gas became present and thereby alert miners to the danger. "
155,Screwed the pooch,Screw the pooch," To make a very serious, grievous, or irreversible mistake; to ruin something or cause something to fail due to such an error. "
156,All hands on deck,All hands on deck,"1. A call for all members of a ship's crew to come to the deck, usually in a time of crisis. (A ""hand"" is a member of a ship's crew.) "
157,Crying wolf,Cry wolf,"To claim that something is happening when it really isn't, which results in the rejection of subsequent valid claims. The expression comes from one of Aesop's fables, in which a young shepherd lies about a wolf threatening his flock so many times that people do not believe him when he and his flock are legitimately in danger. "
158,Cross your t’s dot your i’s,,
159,Over the moon,Over the moon,Extremely happy. 
160,Shoot for the stars,Shoot for the stars,To set one's goals or ambitions very high; to try to attain or achieve something particularly difficult. 
161,Read between the lines,Read between the lines,"To infer or understand the real or hidden meaning behind the superficial appearance of something. ""Lines"" refers to lines of text on a printed page. "
162,Put that in you’re pipe and smoke it,,
163,Rode hard and put away wet,Ride hard and put (something) away wet,"1. Of a horse, to ride it until a lather of sweat has formed, then put it into the stable without drying it. A noun or pronoun can be used between ""ride"" and ""hard."" Primarily heard in US. "
164,Put the axe to the grindstone,,
165,A penny saved is a penny earned,A penny saved is a penny earned," Every small amount helps to build one's savings (i.e. by saving a penny, you have one more penny). "
166,Key to my heart,The key to (one's) heart,"That which will make one very happy or content; the way to make one appreciate, like, or love someone else. "
167,Not in the cards,,
168,You can’t have your cake and eat it too,"You can't have your cake and eat it(, too)"," You cannot have or do two things that are both desirable but normally contradictory or impossible to have or do simultaneously. Because ""have"" can also mean ""eat,"" this expression may seem redundant. However, it is based on the meaning of ""have"" as ""to possess,"" i.e., to maintain possession of one's cake while still eating it, an obvious impossibility. "
169,Kill two birds with one stone,Kill two birds with one stone,"To complete, achieve, or take care of two tasks at the same time or with a singular series of actions; to solve two problems with one action or solution. "
170,I don’t have a horse in that race,,
171,That’s the way the cookie crumbles,That's the way the cookie crumbles,"There is nothing we can do about the way things have unfolded, especially bad ones, so there is no reason to be upset about it. "
172,A straight arrow,Straight arrow,"An honest, ethical person who makes good decisions. "
173,On the straight and narrow,On the straight and narrow,Maintaining a morally upright way of life; only making choices that are considered morally and legally correct. 
174,Fall off the wagon,Fall off the wagon,1. To return to drinking alcohol after a period of abstinence. Usually said of recovering alcoholics. 
175,Knocking on death’s door,,
176,Pushing daisies,,
177,Every rose has its thorn,Every rose has its/a thorn," There is rarely a good or positive thing, event, or circumstance that is not accompanied by some aspect that is negative or unpleasant. "
178,Lightning never strikes the same place twice,Lightning never strikes (the same place) twice, Something that's very extraordinary and unlikely to happen will never happen to the same person twice. (Said especially of tragic or unfortunate events.) 
179,Dog eat dog world,A dog-eat-dog world,"A society, situation, industry, etc. characterized by ruthless behavior and competition. "
180,It’s a small world after all,,
181,Smoke em if you got em,,
182,On the tip of your tongue,On the tip of (one's) tongue,Almost able to be recalled. 
183,Pulled the short straw,,
184,Dear in headlights,,
185,Babe in the woods,Babe in the woods,"A person who is gullible, naïve, or lacks experience in a specific situation. "
186,Cold feet,Cold feet,Nervousness or anxiety felt before one attempts to do something. 
187,Caught red handed,Catch (one) red-handed,"To see, and perhaps apprehend, someone as they are doing something (often something nefarious). The phrase might have originally referred to blood on a murderer's hands. "
188,Going hard in the paint,,
189,On the fence,On the fence,Not making a decision or taking a side when presented with two options or possibilities; undecided. 
190,In the weeds,(deep) in the weeds,"1. Of a restaurant worker, completely overwhelmed with diners' orders and unable to keep up with the pace. "
191,Putting the cart before the horse,Put the cart before the horse,To do things out of the proper order. 
192,Paint the town red,Paint the town (red),"To go out into a city or town and have an enjoyable time, typically by visiting various establishments, such as bars, restaurants, clubs, etc. "
193,Pipe dream,Pipe dream,A dream or idea that is impossible to accomplish. 
194,Chasing the dragon,Chase the dragon," To smoke a controlled substance, often heroin. "
195,Don’t blow smoke up my ass,,
196,Monkey see monkey do,"Monkey see, monkey do",1. Children naturally tend to imitate or copy what they see adults or other children doing. 
