Order,Title,New_Title,Definition
632,The emperor’s new clothes,The emperor's new clothes,"Something widely accepted as true or professed as being praiseworthy due to an unwillingness of the general population to criticize it or be seen as going against popular opinion. Taken from the Hans Christian Andersen fable of the same name, in which a vain king is sold imaginary clothing (i.e., nothing at all) by two weavers who promise him that it is visible only to the wise and cannot be seen by those who are ignorant, incompetent, or unfit for their position. "
633,Kick into gear,,
634,Shooting the shit,Shoot the shit," To chat or converse aimlessly or casually, without any serious topic of conversation. "
635,Something’s rotten in denmark,Something is rotten in (the state of) denmark,Something strange or suspicious is going on. The line comes from Shakespeare's 
636,Exit stage left,Exit stage left,"An allusion to stage directions in theater, indicating when (and where) an actor should leave the stage from a scene."
637,Waiting for the dust to settle,Wait for the dust to settle,1. To wait until a disturbance or commotion has lessened or been resolved. 
638,Throw dust in your eyes,Throw dust in (one's) eyes,To mislead or deceive one by presenting or introducing distracting or obfuscating information. 
639,Achilles heel,Achilles' heel,"A weakness or vulnerability that can lead to permanent destruction or downfall. In Greek mythology, the hero Achilles was killed after being struck in the heel—the only weak spot on his body. "
640,A chain is only as strong as it’s weakest link,,
641,A chink in the armor,Chink in (one's)/the armor,A minor but very detrimental flaw or weakness. 
642,Missing link,Missing link,1. A hypothetical extinct animal that is believed to be the evolutionary connection between man and ape. 
643,Changing gears,Change gear,"1. Literally, to switch a car, bicycle, or other vehicle into a different gear. "
644,When you hear hoofbeats think horses not zebras,"When you hear hoofbeats, think horses, not zebras.","The simplest, most common, or most obvious explanation for something is most likely the correct one. Used especially in relation to medical diagnoses. "
645,In over your head,In over (one's) head,"Too deeply involved in or with a difficult situation, beyond the point of being able to control or cope any longer. "
646,Plenty of fish in the sea,There are plenty of (other) fish in the sea,"There are many other excellent or more suitable people, things, opportunities, or possibilities in the world that one may find. Said especially when one has recently been unlucky, unsuccessful, or has broken up with a romantic partner. "
647,My dogs are barking,(one's) dogs are barking,One's feet are very sore and tired from physical exertion. 
648,Make it rain,Make it rain, To throw or drop dollar bills in a show of wealth. 
649,Put your money where your mouth is,Put (one's) money where (one's) mouth is,"To do, live up to, or follow through on something one talks about, threatens, or promises, especially (but not always) when it involves spending money. "
650,Maiden voyage,Maiden voyage,"1. The first time a vehicle, especially a boat or ship, departs on a journey. "
651,No guts no glory,"No guts, no glory",Success does not come without the courage to take risks. 
652,Flash in the pan,Flash in the pan,Someone or something whose success or popularity is short-lived. 
653,It’s better to burn out than fade away,,
654,Left in the lurch,Leave (one) in the lurch,"To leave or abandon one without assistance in a particularly awkward, difficult, or troublesome situation. "
655,High and dry,High and dry,"1. Literally, dry and unaffected by water, typically flood waters. "
656,Bury the lead,Bury the lead,"In journalism, to open a news article with secondary or superfluous information, thus relegating the central premise (the lead, which usually occupies this position) to a later part. ""Lead"" in this sense is sometimes written as ""lede."" "
657,The sky is the limit,The sky's the limit,Anything is possible. 
658,A rising tide lifts al boats,,
659,Served on a silver platter,,
660,Fed from a silver spoon,,
661,The road paved in gold,,
662,Pillow talk,Pillow talk,Intimate conversations between two people in a romantic relationship when they are in bed together. 
663,Get the ball rolling,Get the ball rolling,"To set something, often a process, in motion; to begin. "
664,Long walk off a short pier,,
665,Bent out of shape,Bent out of shape,"1. Of a person, upset or angry. "
666,Rule the roost,Rule the roost,To be the real boss; to be the person in charge. 
667,Leave the table while you still have an appetite,,
668,Fair weather friend,Fair-weather friend,Someone who remains a friend only when things are going well but abandons others during times of trouble or difficulty. 
669,Jump the gun,Jump the gun,"To start something before it is permissible, appropriate, or advisable. The phrase alludes to starting to run in a foot race before the starting gun goes off. "
670,Show you the ropes,Show (one) the ropes,"To explain or demonstrate to one how to do or perform a job, task, or activity. "
671,Getting something under your belt,Get (something) under (one's) belt,1. To get something to eat or drink. 
672,Shit a brick,Shit a brick," To be very scared or nervous. The plural (""shit bricks"") is also commonly used. "
673,Balls to the wall,Balls to the wall,"With maximum effort, energy, or speed, and without caution or restraint. The phrase most likely originated as an aviation term, referring to the throttle levers of military aircraft (which have a rounded ball on top) being pushed to their maximum limit (i.e., to the bulkhead, or ""wall""). While it does not in fact refer to testicles, it should be used with caution because of this popular association. "
674,Deep dive,Deep dive,"A thorough analysis, perhaps one that seems excessive or unwarranted for a particular topic. "
675,Kick rocks,Kick rocks,An expression of disdain used to tell someone to go away or quit bothering one. 
676,Takes the cake,Take the cake,1. To be the worst in a series of negative actions. Primarily heard in US. 
677,Wrap it up,Wrap it up,1. To get to the point of what one is saying. Often used as an imperative. 
678,Cut some slack,Cut (one) some slack,To allow one more latitude or freedom than usual; to be more lenient with one. 
679,When shit hits the fan,(the) shit hits the fan," Things have become suddenly very chaotic, disastrous, difficult, or controversial. "
680,Under the sun,Under the sun,On earth; in existence. 
681,Gravy train,The gravy train,"A state, position, or job in which one makes an excessive amount of money without expending much or any effort. "
682,Hill i’m willing to die on,,
683,Let your hair down,Let (one's) hair down,"To cease acting formally or conservatively; to ignore or relinquish one's inhibitions or reservations. Also worded as ""let down (one's) hair."" "
684,Time to hang up your hat,,
685,Kick to the curb,Kick (someone or something) to the curb,"To discard, abandon, or dismiss someone or something that has become redundant, obsolete, useless, or unwanted. "
686,Clean slate,Clean slate,An opportunity to start fresh despite past mistakes or problems. 
687,On top of the world,On top of the world,Elated; blissfully or triumphantly happy. 
688,Cut me to the quick,Cut (one) to the quick,1. To slice a part of the body very deeply. 
689,Nothing to hang your hat on,,
690,Pull some strings,Pull (some/a few) strings,"To use the power or influence one has over others, especially people of importance, to get what one wants or to help someone else. "
691,Shit the bed,Shit the bed, To fail spectacularly or to a great degree. 
692,Another notch on your belt,,
693,Shits and giggles,Shits and giggles, Fun or amusement derived without any serious purpose or motivation. 
694,Neck and neck,Neck and neck,Extremely close together; at or near an equal level. Usually said of competitors in a race or competition. 
695,Get this show on the road,Get this show on the road,To promptly begin or get something started. 
696,Play it by ear,Play by ear,"1. To play a piece of music without referencing sheet music or a recording. In this usage, a noun or pronoun can be used between ""play"" and ""by ear."" "
697,Getting something off your chest,,
698,Staying in your own lane,,
699,Put it past someone,,
700,Trusting you as far as you can throw them,,
701,Closed mouths don’t get fed,,
702,Throw me a bone,Throw (one) a bone,To attempt to appease or placate someone by giving them something trivial or of minor importance or by doing some small favor for them. (A reference to giving a dog a bone or scrap from a bigger portion of food.) 
703,Not my cup of tea,Cup of tea,"1. Something one prefers, desires, enjoys, or cares about. Often used in the negative to mean the opposite. "
704,Spill the tea,Spill the tea," To share or reveal gossip. ""Tea"" is a slang term for gossip. "
705,Off the bat,Off the bat,In a trajectory caused by being hit by a bat. 
706,Pulling a rabbit out of a hat,Pull a rabbit out of a hat,"To do something surprising and seemingly impossible; to produce something in a way that has no obvious explanation, as if done by magic. A reference to the magician's trick of literally pulling a live rabbit out of a hat. "
707,Scratched the surface,Scratch,
708,Rub off on someone,Rub off,1. To come off (of something else) after being rubbed. 
709,Off the deep end,Off the deep end, Crazy or irrational. 
710,Toe to toe,Toe-to-toe,"A direct conflict between two people or groups, possibly in close quarters. "
711,By a hair,By a hair,"By an extremely short or slim margin (of distance, time, or another measure). "
712,Chip in,Chip in,"1. To contribute to something being undertaken by a group, such as a task or collection. "
713,The whole enchilada,The whole enchilada, Every part of a multifaceted thing or situation taken together as a whole; the whole thing. 
714,The whole kit and caboodle,The (whole) kit and caboodle,All the parts of a group of things. 
715,Flavor of the month,Flavor of the month,Someone or something very popular but only temporarily or ephemerally. The phrase is often used to describe fleeting romantic relationships. 
716,Sight for sore eyes,A sight for sore eyes," Someone or something that one is excited or overjoyed to see, often after a long absence or separation. "
717,In the pit of your stomach,,
718,Lump in your throat,Lump in (one's) throat,"An intense emotional reaction resulting in a sensation of tightness in the throat, as often precedes crying. "
719,Knock out of the park,Knock (something) out of the (ball)park,To do or perform something extraordinarily well; to produce or earn an exceptional achievement. An allusion to a baseball that is hit hard enough to land outside the stadium. 
720,On pins and needles,On pins and needles,Anxious and tense. (Likely an allusion to the tingling sensation that occurs when blood flow returns to a numb limb.) 
721,Chicken with its head cut off,Like a chicken with its head cut off,With great haste and in a careless or senseless manner. 
722,Over the hill,Over the hill,Past the peak of one's life or career; too old. Often hyphenated. 
723,Piece of cake,Piece of cake,A very easy task or accomplishment. 
724,Have a cow,Have a cow,"To get very upset about something, often more than is expected or warranted. "
725,Bum rush,Bum rush,To attack or barge into a person or place forcefully or violently. 
726,To die for,To die for,"Extremely attractive, enjoyable, or desirable. "
727,Blow your cover,Blow (one's) cover,"To expose one's true identity or motives after they had been intentionally concealed (i.e. after one had been ""undercover""). "
728,Don’t judge a fish by its ability to climb a tree,,
729,The devil is in the details,The devil is in the detail(s)," Plans, actions, or situations that seem sound must be carefully examined, because minor details can end up causing major, unforeseen problems. "
730,Cleanliness is next to godliness,Cleanliness is next to godliness, A phrase that strongly encourages and promotes neatness and personal hygiene. 
731,This town ain’t big enough for the two of us,,
732,Time for a gun fight,,
733,Pop you’re cherry,,
734,Get your rocks off,Get (one's) rocks off,1. 
735,Rock your socks off,,
736,Cool your jets,Cool (one's) jets,1. To calm oneself down; to become less agitated. 
737,Knee jerk reaction,Knee-jerk reaction,"Any spontaneous, reflexive, and unthinking reaction or response. "
738,Ruffle your feathers,Ruffle (one's) feathers,"To annoy, irritate, or upset someone. "
739,Turn over a new leaf,Turn over a new leaf,"To change one's behavior, usually in a positive way. "
740,Rounding the bend,,
741,Par for the course,Par for the course,"Normal, typical, or to be expected (especially when something is a source of annoyance or frustration). An allusion to golf, in which ""par"" is the number of strokes that it should take a player to get the ball into a particular hole on a golf course. "
742,Up in arms,Up in arms,"Very upset or angry about something. Likened to an armed rebellion, from which the phrase originated. "
743,With guns blazing,With (one's) guns blazing,"Forcefully and with all of one's energy and a strong sense of urgency or purpose, especially when directed at an argument or problem that has angered or frustrated one. "
744,Make heads or tails of it,,
745,Tits up,Tits up,"1. mildly vulgar Broken or malfunctioning; dead, falling apart, or ceasing to work. (""Tits up"" is sometimes hyphenated.) "
746,Sit on it,Sit on it,An exclamation of frustration directed at another person. Popularized by the TV show 
747,Sticking your foot in your mouth,,
748,Get off on the wrong foot,Get off on the wrong foot,To have a bad start. Said of something that goes or has gone awry at the very beginning. 
749,Bright eyed and bushy tailed,Bright-eyed and bushy-tailed,Energetic and enthusiastic. 
750,Squeezing the lemon,,
751,Bleeding the lizard,,
752,Choking the chicken,Choke the chicken, To masturbate. A term only applied to males. 
753,Beating the meat,Beat (one's) meat, To masturbate. A term only applied to males. 
754,Flicking the bean,,
755,Soften the blow,Soften the blow,To make the impact of something negative less harmful. 
756,Sitting pretty,Sit pretty,To be or remain in an ideal situation or advantageous position. 
757,Tasted grapes,,
758,Cloud 9,Cloud nine, 
759,Walking on sunshine,Walk on sunshine,To be in a state of euphoria. 
760,Putting in leg work,,
761,In the limelight,In the limelight,At the center of attention. The phrase refers to a type of lamp that was previously used in theatrical stage lighting. 
762,15 minutes of fame,15 minutes of fame,A brief period of celebrity or notoriety. The term was coined by artist Andy Warhol. 
763,Hit the bricks,Hit the bricks,"1. To depart, often on foot. "
764,End of the line,The end of the line,"1. The physical end of a route of travel, usually a bus or train route. "
765,In the thick of it,In the thick of it,Very busy; in the middle of or preoccupied with something or several things. 
766,Run of the mill,Run-of-the-mill,"Common, standard, or average; mediocre. "
767,Off the cuff,Off the cuff,Casually and spontaneously; without planning or preparation. Often hyphenated. 
768,Dark night of the soul,Poem and treatise of st. john of the cross,
769,Off the rails,Be off the rails,"1. To be in a state of chaos, dysfunction, or disorder. "
770,Living under a rock,Live under a rock,"To be oblivious to or ignorant of something that is very widely known, often related to pop culture. "
771,True measure of a man,,
772,To live in someone’s shadow,,
773,To never measure up,,
774,Golden goose,Golden goose,"A person, thing, or organization that is or has the potential to earn a lot of money for a long period of time. Taken from a folk tale of a goose that would lay a golden egg once a day, but which was killed by its owner because he wanted all of its gold at once. "
775,Beyond the pale,Beyond the pale,"Completely unacceptable or inappropriate. A ""pale"" is an area bounded by a fence. "
776,Revenge is a dish best served cold,Revenge is a dish best served cold.,"Revenge that takes place far in the future, after the offending party has forgotten how they wronged someone, is much more satisfying. "
777,Fall from grace,Fall from grace,"To fall out of favor, typically due to having done something that tarnishes one's reputation. "
778,This day in age,,
779,Do the honors,Do the honors,"To perform a task or duty of an official nature, often in a social setting. Sometimes used humorously. "
780,That tracks,,
781,Pull the trigger,Pull the trigger (on something),To make a final decision or commit to a certain course of action (about something). 
782,In the the chute,,
783,Down the hatch,Down the hatch,Down one's throat. This phrase is usually said before one drinks something (often something that has an especially foul or strong taste). 
784,Batten down the hatches,Batten down the hatches,"To prepare for a challenging situation. While this originated as a nautical phrase, it is now used for any sort of imminent problem. "
785,To not give two shits,,
786,Dog and pony show,Dog and pony show,An elaborately organized event used mainly for promotion or to drive sales. 
787,Throw your hat in the ring,Throw (one's) hat in(to) the ring,"To announce that one is going to be competing with others, especially in a political election. "
788,My enemy’s enemy is my friend,My enemy's enemy is my friend, A phrase highlighting how a common enemy can be a unifying force for otherwise disparate groups or people. 
789,Taking the high road,,
790,Have a falling out,A falling out,"A severe quarrel or disagreement, especially one that leads to a temporary or permanent end of a relationship. "
791,A broken record,,
792,A bridge too far,A bridge too far," An act or plan whose ambition overreaches its capability, resulting in or potentially leading to difficulty or failure. Taken from the 1974 book "
793,Think outside the box,Think outside (of) the box,"To think of something that is outside of or beyond what is considered usual, traditional, or conventional; to think innovatively. "
794,One fell swoop,One fell swoop,A single decisive or powerful action. 
795,Addressing the elephant in the room,,
796,Opening up pandora’s box,,
797,Pot of gold at the end of the rainbow,Pot of gold at the end of the rainbow,"The ultimate goal, reward, achievement, etc., at the end of a difficult or arduous process. "
798,Live off the fat of the land,Live off the fat of the land,"To live comfortably on a surplus of resources, without working very hard. "
799,Get a lay of the land,,
800,Get the juices flowing,,
801,Eye opening,Eye-opening,Causing or resulting in a shocking or startling revelation. 
802,Poking the bear,Poke the bear,"To intentionally irritate or bother someone, especially when doing so carries an obvious risk. "
803,Spin a web of lies,Spin a web of lies,"To create an intricate contrivance of misdirection, omission, or deception that ultimately serves to ensnare or entangle oneself or others. "
804,Coming out of your shell,Come out of (one's) shell,"To be or become less shy or reticent and more sociable, outgoing, or enthusiastic. "
805,Shedding your skin,,
806,Put some feelers out,,
807,Barrel of monkeys,Barrel of monkeys,"A group that is having fun and enjoying themselves. Often used in the phrase ""more fun than a barrel of monkeys."" "
808,Monkey see monkey do,"Monkey see, monkey do",1. Children naturally tend to imitate or copy what they see adults or other children doing. 
809,Getting your ass handed to you,,
810,Come full circle,Come full circle,"To return to the original or a similar position, situation, or circumstance where one or something started. "
811,High on the hog,High on the hog,"Ostentatiously. The phrase refers to the rich being able to afford the choicest cut of meat, which, from a pig, is higher up on the animal. "
812,Taking the words out of someone’s mouth,,
813,To be blown away,,
814,Setting the bar low,Set the bar (high/low),"To establish an expected, required, or desired standard of quality. (Often said of a standard that is constrictive in being either too low or too high). "
815,Game changer,Game-changer, That which dramatically or fundamentally alters a situation or the way in which something is done or thought about. 
816,Keep your eyes peeled,Keep (one's) eye(s) peeled (for someone or something),To remain vigilant or carefully watchful (for something or someone). 
817,Hell hath no fury like a woman’s scorn,,
818,Top notch,Top-notch,Stellar; excellent; the best. Can be used with or without a hyphen. 
819,Hit or miss,Hit or miss," Sometimes good or successful, sometimes not; having mixed or unpredictable results; random, aimless, careless, or haphazard. Often hyphenated. "
820,Shooting your shot,Shoot (one's) shot," To take the risk of making one's availability and interest known to others, as to a prospective employer or romantic partner. "
821,Hidden gem,Hidden gem,That which is of exceptional or underappreciated quality but is not especially popular or widely known. 
822,Too big for your britches,Too big for (one's) boots,"Overconfident in one's importance, skill, or authority; behaving as if one is more important or influential than one actually is. "
823,Get a big head,Get a big head,To become arrogant or conceited; to assume an exaggeratedly high opinion of oneself. 
824,Getting on your soap box,,
825,Preaching to the choir,Preach to the choir,To try to convince someone about something that they already support; to state one's opinion to those who are already most receptive to it. 
826,Had it up to here,,
827,Turn an burn,,
828,On a roll,On a roll,"Experiencing a particularly successful period, without any setbacks or low points. "
829,Short fuse,A short fuse,"A tendency to become angered, enraged, or upset very quickly or easily; a short temper. "
830,Hot headed,Hothead,"A person with an excitable, fiery, or impetuous temper or disposition; one who is quick to get angry or act rashly. "
831,Having a ring to it,,
832,Dropping the kids off at the pool,,
833,Bun in the oven,A bun in the oven, An unborn child growing in one's womb. 
834,Another face in the crowd,,
835,A fine line,A fine line,"A very narrow division between two deceptively similar things, one of which is worse than the other. "
836,Saving something for a rainy day,Save (something) for a rainy day,"To reserve something, especially money, for use in a time or period of unforeseen difficulty, trouble, or need. "
837,Shaking in your boots,Shake in (one's) boots,To tremble with fear. Often used sarcastically. 
838,Water water all around and not a drop to drink,,
839,Let your guard down,Let (one's) guard down,To become less guarded or vigilant; to stop being cautious about potential trouble or danger. 
840,Hole in the wall,Hole in the wall,"A small, inconspicuous place, often an establishment such a restaurant. The term sometimes but not always has a negative connotation implying a place that is perceived to be disreputable in some way. "
841,Pulling teeth,Pull teeth,"1. To do something that is especially difficult, tedious, or requires an extreme amount of effort; to do something in the most difficult or unpleasant way possible. "
842,Take a load off,Take a load off (one's feet),To sit down and rest one's feet; to relax. (Usually said as a suggestion.) 
843,Shit end of the stick,,
844,Tide me over,Tide (one) over,"To maintain, sustain, or support one through a lean or difficult time until more of something is acquired, especially food or money. "
845,By the skin of your teeth,By the skin of (one's) teeth,Barely. Often used to describe something that almost didn't happen. 
846,Ride on someone’s coattails,,
847,Shit rolls down hill,,
848,In a heartbeat,In a heartbeat,Very quickly; as soon as is possible. 
849,Calm before the storm,Calm before the storm,A period of inactivity or tranquility before something chaotic begins. Likened to a literal period of calm before a storm begins. 
850,Take by storm,"Take (someone, something, or some place) by storm","1. To conquer, seize, or lay siege to something, someone, or some place with a sudden and furious attack. "
851,Lift the veil,Lift the veil (on something),"To divulge, explain, or reveal something that was previously a secret. "
852,A feather in your cap,A feather in (one's) cap,An accomplishment or achievement that one takes pride in. 
853,Clear cut,Clear-cut,1. 
854,Head over heals,,
855,Going for broke,Go for broke,To give something one's full effort. 
856,Steal the show,Steal the show,"To become the main focus of attention or deliver the most captivating performance in the presence of one or more others, typically unexpectedly. "
857,In a nutshell,In a nutshell,In summary; concisely. 
858,Throw away the key,Lock (someone) up and throw away the key,To incarcerate someone in prison forever or indefinitely. 
859,In hog heaven,In hog heaven,In a state of extreme happiness. 
860,Joined at the hip,Joined at the hip," Always near or spending a lot of time with someone else, often a close friend. "
861,Over your head,Over (one's) head,1. Too complicated to be understood by one. 
862,In too deep,In too deep,Too involved in something to easily extract oneself or make reasonable decisions. 
863,Under the spotlight,Under the spotlight,The center of attention. 
864,Under a microscope,Under a microscope,Under close inspection or intense scrutiny. 
865,Tag team,Tag team,1. 
