Order,Title,New_Title,Definition
197,Pull yourself up by your bootstraps,Pull (oneself) up by (one's) (own) bootstraps,"To improve one's life or circumstances through one's own efforts, rather than relying on others. "
198,Rat race,Rat race,"1. A fierce competition for success, wealth, or power. "
199,Written in stone,Written in stone,Permanently fixed or firmly established; incapable of being changed. Often used in the negative. 
200,Smooth sailing,Smooth sailing,"Progress or advancement that is free from difficulties, obstacles, or challenges. "
201,All down hill from here,,
202,Shooting blanks,Shoot blanks," Of a man, to have a low sperm count in his semen. "
203,Pushing rope,,
204,Blacker the berry sweeter the juice,,
205,Over my dead body,Over my dead body,"I will never allow it; under no circumstances will that be permitted to happen (i.e., something can only happen if I am not alive to prevent it). "
206,Raise the roof,Raise the roof,"To engage in loud, unrestrained, and boisterous behavior, especially at a party or while celebrating. "
207,It takes village to raise a child,,
208,Get on board,,
209,Below the belt,Below the belt,"Unfairly targeted at one's weakness or vulnerability. The phrase refers to boxing, in which hitting an opponent below the waist is prohibited. "
210,0 to 60,Go from zero to sixty,"1. To accelerate from a standstill to sixty miles per hour. Used to indicate how quickly a vehicle, especially an automobile, can accelerate. "
211,Turn on a dime,Turn on a dime,1. To turn very quickly and with great agility. 
212,Once bitten twice shy,"Once bitten, twice shy","Once one is hurt by someone or something, one will be extra cautious to avoid that person or thing. "
213,The road to hell is paved with good intentions,The road to hell is paved with good intentions, Good intentions do not matter if a person's actions lead to bad outcomes. 
214,Don’t shit where you eat,Don't shit where you eat," Do not engage in troublesome or dubious behavior at one's home, place of business, or any location where one frequents, for it invites undesired consequences. "
215,Don’t dip the pen in company ink,,
216,Pulling your leg,Pull (one's) leg,"To tease or joke with someone, often by trying to convince them of something untrue. "
217,Jerking your chain,Jerk (one's) chain,"To tease someone, often by trying to convince them of something untrue. "
218,The Blood of the covenant is thicker than the water of the womb,,
219,Stabbed in the back,Stabbed in the back,Having had one's confidence or trust betrayed. 
220,Glass half empty,Glass half empty,Of or characterized by a generally pessimistic worldview. (Typically hyphenated and used as a modifier before a noun.) 
221,Well runs dry,,
222,Strike gold,Strike gold,"1. Literally, to discover gold, as in a gold mine. "
223,Ruling with an iron fist,Rule with an iron fist,"To rule, govern, or control a group or population with complete, typically tyrannical authority over all aspects of life, work, etc. A noun or pronoun can be used between ""rule"" and ""with."" "
224,Now we’re cooking with gas,Now (one's) cooking (with gas),Now one is making progress or doing something right. 
225,Not on the same page,,
226,Stop and smell the roses,Stop and smell the roses,"To take time to enjoy the finer or more enjoyable aspects of life, especially when one has become overworked or overly stressed. "
227,Slippery slope,Slippery slope,"A situation in which some behavior or action will eventually lead to a worse form of the same behavior or action, or a disastrous outcome. "
228,Pick your battles,Pick (one's) battle(s),"To choose not to participate in minor, unimportant, or overly difficult arguments, contests, or confrontations, saving one's strength instead for those that will be of greater importance or where one has a greater chance of success. "
229,On my last leg,On (one's) last legs,Near physical collapse or death. 
230,Watch a pot it never boils,,
231,The tip of the iceberg,Just the tip of the iceberg,"Only a small, often unrepresentative portion of something much larger or more complex that cannot yet be seen or understood. "
232,Needle in a haystack,Needle in a haystack,Something that is very difficult to locate. 
233,Still waters run deep,Still waters run deep,"Quiet people have interesting, profound, or complex thoughts. "
234,An elephant never forgets,An elephant never forgets,One remembers everything. A play on the idea that elephants have great memories. 
235,Trojan horse,Trojan horse,1. Something that initially seems innocuous but is ultimately bad or malicious. A reference to the myth in which Ancient Greek soldiers hid inside a giant wooden horse in order to gain access to the city of Troy. 
236,Like a fish in water,,
237,Where there’s smoke there’s fire,"Where there's smoke, there's fire"," When there is some indication of a problem or wrongdoing, such a thing probably occurred or exists. "
238,Shot in the dark,A shot in the dark,1. A guess or estimate with very little or no assurance as to its accuracy. 
239,If you can’t beat ‘em join em,,
240,Low hanging fruit,Low-hanging fruit,1. That which is especially easy to obtain or achieve. Often implies something that is perhaps not as satisfying as that which takes more effort or skill to obtain or do. 
241,Let it slide,Let (something or someone) slide,To choose not to take any action to correct or improve a particular situation or someone's actions or behavior. 
242,Pass the buck,Pass the buck,"To shift or reassign the blame or responsibility (for something) to another person, group, or thing. "
243,X marks the spot,X marks the spot,This sign or mark (not necessarily an X) indicates the specific or exact location (of something). 
244,15 minutes of fame,15 minutes of fame,A brief period of celebrity or notoriety. The term was coined by artist Andy Warhol. 
245,Hit the spot,Hit the spot,"1. To satisfy something, such as hunger or a craving. "
246,Made in the shade,Made in the shade,"In a comfortable position in life, usually due to some manner of financial success or windfall. "
247,Run for your money,Run for (one's) money,1. A prolonged period of success. 
248,Chopped liver,Chopped liver," A trivial, unimportant, or unappealing person or thing. The phrase likely originated as a part of Jewish humor, referring to the serving of chopped liver as a common side dish (thus overlooked in favor of the main course), the taste of which many do not find appealing. "
249,Out to lunch,Out to (some meal),Away from one's normal location to eat a particular meal. 
250,Circling the drain,Circle the drain,"To be in a state of severe deterioration such that one is approaching inevitable ruin, failure, or death. Usually used in the continuous form. "
251,That’s the ticket,That's the ticket,That is exactly the thing that is or was needed or called for. 
252,Sloppy seconds,,
253,Back in the fold,,
254,Take someone under your wing,Take (someone) under (one's) wing,"To act as someone's guardian, protector, or mentor, especially someone who is vulnerable or in need of help, protection, or instruction. "
255,We’re not in kansas anymore,Be not in kansas anymore,To no longer be in a place that one knows or where one is comfortable; to be in a completely unfamiliar and/or discomfiting environment. A reference to 
256,Out of the woods,Out of the wood(s),"No longer in danger or dealing with a particular difficulty, though not entirely resolved. Usually used in the negative. "
257,Balls of steel,,
258,Eyes too big for your stomach,,
259,Doe eyed,,
260,Snug as a bug in a rug,Snug as a bug (in a rug),"Very warm and cozy, typically while wrapped in blankets. "
261,The cat that ate the canary,The cat that ate the canary,Someone who is smugly pleased or self-satisfied. 
262,Tongue twister,Tongue twister,A word or phrase that is hard to say clearly due to difficult alliteration or pronunciation. 
263,Roll of the dice,Roll of the dice,1. An especially risky action undertaken to achieve a favorable but unlikely outcome. 
264,He’s lost his marbles,,
265,Playing with fire,Play with fire,"To do something that risks causing one harm, damage, or misfortune; to do something dangerous. "
266,Dead of night,Dead of night,The middle of the night. 
267,Perfect storm,Perfect storm,"A chance or rare combination of individual elements, circumstances, or events that together form a disastrous, catastrophic, or extremely unpleasant problem or difficulty. "
268,Cut corners,Cut corners,"To skip certain steps in order to do something as easily or cheaply as possible, usually to the detriment of the finished product or end result. "
269,Tall drink of water,Tall drink of water,"A tall, typically slender person. "
270,The road less traveled,The road less traveled,"The less popular or common option. The phrase is typically associated with Robert Frost's 1916 poem ""The Road Not Taken."" "
271,A square peg in a round hole,A square peg in a round hole,"A person who does not fit in or is not comfortable with others or in a particular situation; someone who is unsuited to a certain task, position, situation, or group of people. "
272,Bouncing off the walls,Be bouncing off the walls,To be very active and energetic to the point of hyperactivity. 
273,Tie a pork chop around it neck to get the dog to play with it,,
274,Color me pink,,
275,Like lemmings to the sea,,
276,A scholar and a gentleman,A scholar and a gentleman," Someone (usually a male, due to the gender implication of ""gentleman"") who is admirable or of high esteem. Although used sincerely as a compliment, it is generally bombastic and lighthearted in nature. "
277,Gone with the wind,Gone with the wind,"A phrase used to describe something that has disappeared, passed, or vanished, permanently or completely. The phrase was popularized by Margaret Mitchell's 1936 novel of the same name. "
278,Old hat,Old hat,"Unoriginal, out of date, or old-fashioned. "
279,Doesn’t fit the mold,,
280,Left a bad taste in your mouth,Leave a bad taste in (one's) mouth,To give one a negative impression (based on something that has already happened). 
281,Cold shoulder,Cold shoulder,1. 
282,Tongue in cheek,(with) tongue in cheek,"Humorous or intended as a joke, though seeming or appearing to be serious. Hyphenated as ""tongue-in-cheek"" if used before a noun. "
283,When there’s a will there’s a way,,
284,No harm no foul,"No harm, no foul","If there was no bad outcome to an action, then there's no need to be angry or upset about it. "
285,Cut the chord,,
286,Hit the hay,Hit the hay,To get into bed and go to sleep. 
287,Live by the sword die by the sword,"Live by the sword, die by the sword",1. Those who live a violent lifestyle will usually die a violent death. 
288,Knocking boots,Knock boots (with one), To have sex (with one). 
289,Bumping uglies,Bump uglies, To have sex. 
290,Get your ears lowered,Get (one's) ears lowered,"To get a haircut, especially to a length that reveals one's ears. "
291,Dragging your feet,Drag (one's) feet,"1. Literally, to not completely pick up one's feet when walking, so that they drag with each step. "
292,With your tail between your legs,With (one's) tail between (one's) legs,"Displaying embarrassment or shame, especially after losing or having to admit that one was wrong. Likened to a dog literally putting its tail between its legs after being disciplined. "
293,Spic and span,Spick and span,Totally clean and/or organized. 
294,Roll in the hay,Roll in the hay,"A sexual encounter, often one considered casual. "
295,Run the gamut,Run the gamut,To cover or extend across a wide and varied range. 
296,If it was a snake it would of bit you,,
297,If looks could kill,If looks could kill,"An expression used when someone makes an angry or unpleasant face at someone, indicating that such an expression represents hostility. "
298,Staring daggers,,
299,No skin off my back,Be no skin off (one's) back,"To be no cause of concern or interest to one; to pose one no difficulty, threat, or risk. "
300,Carrot on a stick,Carrot on a stick,"A reward that is promised to someone as an incentive to complete some task. It is a variant of ""carrot and stick"" or ""carrot or stick,"" which refer to both reward and punishment being simultaneously offered/threatened as an incentive to complete a task. "
301,Comparison is the thief of joy,,
302,Robbing the cradle,Rob the cradle,To date someone who is much younger than oneself. 
303,Going the way of the buffalo,,
304,Shell of your former self,A shell of (someone's or something's) former self,"A person, group, place, etc., that has become dramatically less healthy, vivacious, or robust, often following some traumatic event or negative circumstances. "
305,The call is coming from inside the house,,
306,Coming out swinging,Come out swinging,To compete or defend someone or something passionately or aggressively. 
307,Rose colored glasses,Rose-colored glasses,"An unduly idealistic, optimistic, sentimental, or wistful perspective on or about something. Primarily heard in US. "
308,Fog of war,The fog of war,"Confusion, uncertainty, or skewed judgment caused by the violence and chaos of warfare, especially in relation to one's own capability compared to that of one's enemy. "
309,The whole 9 yards,,
310,Turning over in your grave,(someone) is/would be turning over in their grave,"The thing in question is offensive to the memory of someone; someone would be filled with shame, disgust, or disapproval if they were alive today. "
311,Shooting fish in a barrel,Like shooting fish in a barrel,"Of some task or activity, exceptionally easy to do or accomplish. "
312,Light a fire under your ass,,
313,An old flame,An/(one's) old flame,One's former lover. 
314,Up in smoke,Up in smoke,1. Destroyed by fire. 
315,Fighting fire with fire,Fight fire with fire,To retaliate with the same methods that one has had to endure. 
316,Firing in all cylinders,,
317,The lion’s share,The lion's share,The largest part or portion of something. 
318,Pedal to the metal,Pedal to the metal,1. Drive as fast as you can; push the accelerator down. 
319,Throw in the towel,Throw in the towel,To give up on some endeavor; to quit or abandon something; to admit defeat or failure. 
320,Waking up on the wrong side of the bed,Wake up on the wrong side of (the) bed,"To be in a particularly and persistently irritable, unhappy, or grouchy mood or state, especially when it is not in line with one's normal disposition. "
321,Wrong side of the tracks,The wrong side of the tracks,"A part of a town or city that is particularly impoverished (and usually dangerous or undesirable as a result). ""Tracks"" refers to railroad tracks, which are sometimes thought of as demarcating different economic areas of a town. "
322,Dumpster fire,Dumpster fire," A complete and utter disaster or a completely chaotic situation, likened to a fire in a dumpster, which quickly becomes uncontrollable. The phrase can be applied to both situations and people. "
323,The front lines,,
324,Don’t cry over spilt milk,,
325,Meat shield,,
326,Throw up a white flag,,
327,Throw down the gauntlet,Throw down the gauntlet,"To issue a challenge or invitation, as to a fight, argument, or competition. "
328,Getting your foot in the door,Get a/(one's) foot in the door,To have a chance to do something that could lead to further opportunities. The phrase is often used to refer to employment. 
329,One foot out the door,One foot out the door,A lack of commitment to or eagerness to give up on someone or something. 
330,Dip your toe in,Dip (one's) toe in(to) (something),To tentatively begin or get involved in a new experience. Likened to gently placing one's toe into water to test its temperature. 
331,Test the waters,Test the water(s),"To informally or casually attempt to gauge the reaction of a potential audience or recipient of something, or to try to get an idea of what something will be like before actually doing it. Likened to feeling the temperature of water before getting in. "
332,Play the field,Play the field,1. To bet on all horses in a race other than the one favored to win. 
333,Play ball,Play ball,"1. In baseball, a phrase traditionally said or shouted by the umpire to start the game. "
334,Throw it at the wall and see what sticks,,
335,Watch a pot it never boils,,
336,That’s all she wrote,That's all she wrote,This is the end; there is nothing left to say. 
337,Head too big to fit in the door,,
338,Kick the can down the road,Kick the can down the road,"Especially in politics, to postpone or defer a definitive action, decision, or solution, usually by effecting a short-term one instead. "
339,Stepping on toes,Step," Used with the prepositions ""in"" or ""out of."""
340,Reading the writing in the wall,,
341,Coming out of the woodwork,Come out of the woodwork,"To appear unexpectedly, or from unexpected places. "
342,If walls could talk,Background,"First, in January 2000, there were rumors that ""If Walls Could Talk"" would be Dion's next single in the United Kingdom. But two months later, Sony Music UK released """
343,Fly on the wall,Fly on the wall,One who is able to observe something closely but invisibly and without interfering in the situation. 
344,The walls have ears,The walls have ears,Someone might be eavesdropping. 
345,Blow this popsicle stand,Blow this popsicle stand,"To leave a place, especially one that has become dull or of no use or interest, generally in search of something better. Often preceded by ""let's."" "
346,Till the wheels fall off,The wheels fall off,Things go disastrously wrong; a situation devolves into ruin or chaos. 
347,Hot on your tail,,
348,Bone to pick,A bone to pick,An issue to discuss—typically one that is a source of annoyance for the speaker. 
349,Put out to pasture,Put (someone or something) out to pasture,"1. Literally, to retire an animal from working by allowing it roam in a field or pasture. "
350,Ball and chain,Ball and chain,"1. Something, usually a responsibility of some kind, that restricts one's freedom or limits one's possibilities for personal pursuits. "
351,Down in the dumps,Down in the dumps,Sad or depressed. 
352,Don’t let the bed bugs bite,Don't let the bedbugs bite," Sleep soundly and well. Part of the sing-song rhyme ""good night, sleep tight, don't let the bedbugs bite,"" usually said to a child. "
353,Smoke and mirrors,Smoke and mirrors,"Trickery, deception, or misdirection. "
354,Running circles around someone,Run circles around (someone or something),1. To move much faster than someone or something. 
355,Picking up slack,,
356,Burning the midnight oil,Burn the midnight oil,To stay up late working on a project or task. The phrase refers to the outdated practice of using an oil lamp. 
357,Pass the torch,Pass the torch,"To transfer or bestow one's role, position, responsibilities, etc., to someone else. "
358,Butterflies in your stomach,Butterflies in (one's) stomach,A feeling of nervousness. 
359,The lady doth protest too much,The lady doth protest too much,"Used to indicate that someone (not necessarily a woman) is only denying something so fervently because the opposite is actually true. Adapted from the line ""the lady doth protest too much, methinks"" in Shakespeare's "
360,Not all hero’s wear capes,,
361,Walking on eggshells,Be walking on eggshells,To be acting with great care and consideration so as not to upset someone. 
362,Treading water,Tread water,1. To move one's feet and hands in a motion that will allow one to keep one's head above the surface of the water. 
363,Keeping your head above water,Keep (one's) head above water,"1. Literally, to hold one's head out of the water as to avoid drowning. "
364,Under the table,Under the table,1. Secretly (often because what is being done is illegal). 
365,Tables have turned,,
366,Deep-6,Deep six,1. 
367,6 feet under,,
368,Look on the bright side,Look on the bright side,To highlight the good in an otherwise bad situation. 
369,Casting a wide net,Cast a wide net,"To do something that will attract, appeal to, or include as large or diverse a group of people as possible. "
370,Paint with broad strokes,,
371,Food for thought,Food for thought,Something to consider. 
372,Penny pinching,Penny pincher,Someone who is extremely frugal or miserly with their money; someone who is very unwilling or reluctant to spend. 
373,Cream of the crop,The cream of the crop,The best of a particular group. 
374,Separate the wheat from the chaff,Separate the wheat from the chaff,To separate the good or valuable from that which is inferior. 
375,Reel it in,Reel in,"1. To draw someone or something toward oneself by winding in a line. A noun or pronoun can be used between ""reel"" and ""in."" "
376,Right hand man,Right-hand man,One's primary or most trusted assistant. Not necessarily a man. 
377,No man is an island,"No man is an island(, entire of itself)",A person requires the company and support of others and society as a whole in order to thrive. The line is from John Donne's 
378,Revenge is a dish best served cold,Revenge is a dish best served cold.,"Revenge that takes place far in the future, after the offending party has forgotten how they wronged someone, is much more satisfying. "
379,Opportunity is not a lengthy visitor,,
380,If you want to make an omelette you have to break some eggs.,,
381,Give ‘em enough rope to hang himself with,,
382,Kick them while they’re down,,
383,Tying the knot,Tie the knot,"To get married. An allusion to the handfasting ceremony, an ancient tradition of binding the hands of the bride and groom with lengths of cloth, cord, rope, etc., as a symbol of their lasting union. "
384,Tie up loose ends,Tie up (some/a few) loose ends,"To take care of, finish, or resolve some issues or pieces of business that are not critical but have remained outstanding. "
385,If it ain’t broke don’t fix it,"If it ain't broke, don't fix it","If something is performing or functioning well enough, there's no need to change or interfere with it (as you may introduce new problems as a result.) "
386,My ears are burning,(one's) ears are burning,"One intuits that people were talking about them, despite not witnessing it. "
387,The ball is in your court,The ball is in (one's) court,"One has the responsibility for further action, especially after someone else previously held responsibility. The phrase originated in tennis. "
388,Once in a blue moon,Once in a blue moon,Very rarely. 
389,As right as rain,(as) right as rain,In good health or order; feeling or working just as someone or something should. 
390,The bark is worse than the bite,,
391,Path of least resistance,The path of least resistance,"The thing, option, or course of action that is easiest to do; that which avoids confrontation, difficulty, awkwardness, or tension. "
392,Keeping me on my toes,Keep (one) on (one's) toes,"To force someone to stay active, alert, and focused on something or someone. "
393,Go touch grass,,
394,In a pickle,In a pickle,"In a troublesome or difficult situation. The adjectives ""pretty"" and ""right"" are commonly used before ""pickle."" "
395,Caught with your hand in the cookie jar,Caught with (one's) hand in the cookie jar,"To have been caught in the act or attempt of some wrongdoing, especially one involving bribery or the illicit exploitation of one's position of power or authority. "
396,Trim the fat,Trim the fat,To excise or discard elements that are seen as superfluous or unnecessary. 
397,Taking candy from a baby,,
398,To flesh out,,
399,Get ahead of the game,Get ahead of the game,1. To become prepared for or begin work on something ahead of schedule. 
400,In the trenches,(down) in the trenches,"The place, situation, or environment in which the most difficult or demanding work takes place. "
401,Cross that bridge when we come to it,Cross that bridge when (one) comes to it,To address something only when it actually happens or becomes an issue. 
402,Take at at face value,,
403,Toe the line,Toe the line,"To adhere to the rules of something. (Often misspelled as ""tow the line."") "
404,Draw a line in the sand,Draw a line in the sand,To establish a figurative boundary that someone or some group refuses to cross or beyond which no further advance or compromise is accepted. 
405,On framing time,,
406,Hold my beer,Hold my beer,A phrase indicating that one is about to do something stupid or dangerous. The image is that of a person at a party who asks a friend to hold their beer so that they can attempt some kind of ill-advised stunt. It is often used humorously to describe how something bad was followed by something even worse. 
407,Don’t feed them after midnight,,
408,Short end of the stick,The short end of the stick,An unequal outcome of a deal that results in a disadvantage or burden. 
409,Beating a dead horse,Beat a dead horse,To continue to focus on an issue or topic that is no longer of any importance or relevance. 
410,Slippery fish,,
411,Snake in the grass,Snake in the grass,One who feigns friendship with the intent to deceive. 
412,Sit back and rest on your laurels,,
413,Barefoot and pregnant,Negative connotations,A common assumption is that the expression relates to 
414,Rule of thumb,Rule of thumb,An approximation; a suggested method or guideline. 
415,Ring a bell,Ring a bell,"To seem familiar, remind one of something, or stimulate an incomplete or indistinct memory. "
416,Fly by the seat of your pants,Fly by the seat of (one's) pants,"To rely on one's instinct, as opposed to acting according to a set plan. "
417,Play stupid games win stupid prizes,"Play stupid games, win stupid prizes","If you engage in behavior that is stupid, obnoxious, or reckless, you will suffer unpleasant consequences. "
